{
  "schemaVersion": 1,
  "provenance": {
    "source": "GitHub REST API via gh",
    "capturedBy": "npm run m26:github:sync",
    "population": "all-state",
    "networkAccess": false,
    "archiveCount": 108,
    "liveCount": 0,
    "disposition": "RECONCILED"
  },
  "observedAt": "2026-09-30T08:19:24.322Z",
  "baseSha": "6080ee12fe64ddef0f9edd0f42536e43e0c64668",
  "issues": [],
  "milestones": [
    {
      "number": 26,
      "title": "M25 - Ecosystem and Verification Intelligence",
      "state": "closed",
      "open_issues": 0,
      "closed_issues": 0,
      "provider_open_issues": 0,
      "provider_closed_issues": 0,
      "due_on": null,
      "description": "## Outcome\n\nA public, reproducible ecosystem turns Mjölnir trust data into better verification decisions, integrations, custom standards, and measurable product leadership.\n\n## Entry gate\n\n- M20 through M24 trust, scale, agent, control-plane, and enterprise contracts are stable.\n\n## Exit gate\n\n- Third parties can reproduce benchmarks and build safe extensions.\n- Ecosystem artifacts are signed and auditable.\n- Adoption is measured through verified release decisions and retained teams.\n- Quality guardrails improve rather than trade away determinism.\n- Language throughput remains measurable and the next frontier is activated without a blanket coverage claim.\n- Commercial packaging is validated with customers.\n\n## Dependencies\n\n- [M20-01](https://github.com/Sergey-Bar/Mjolnir/issues/561)\n- [M21-01](https://github.com/Sergey-Bar/Mjolnir/issues/574)\n- [M22-01](https://github.com/Sergey-Bar/Mjolnir/issues/587)\n- [M23-01](https://github.com/Sergey-Bar/Mjolnir/issues/601)\n- [M24-01](https://github.com/Sergey-Bar/Mjolnir/issues/616)\n\n## Non-goals\n\n- Do not promise market leadership, universal language support, or a guaranteed commercial outcome.\n- Do not let probabilistic, model-generated, or third-party output silently change a blocking verdict.\n- Do not retain raw source by default or make hosted intelligence a prerequisite for local verification.\n- Do not use commercial packaging, translations, or case studies as dark patterns or unsupported claims.\n- Do not turn the rolling language program into a fixed end-state promise.\n\n## Tracking issue\n\n[M25-01 — Track ecosystem and verification intelligence](https://github.com/Sergey-Bar/Mjolnir/issues/632)"
    }
  ],
  "pullRequests": [
    {
      "number": 695,
      "title": "feat(corpus): the re-measurement tool §07 asks for, and the first result",
      "url": "https://github.com/Sergey-Bar/Mjolnir/pull/695",
      "state": "merged",
      "head_sha": "134cf8cd92861bd5bfde8359e89fd69246624ee6",
      "base_sha": "3314b275d1821c6eaa10bf4a4ebc864c01b7d6db",
      "created_at": "2026-09-28T18:33:10Z",
      "updated_at": "2026-09-28T19:52:14Z",
      "merged_at": "2026-09-28T19:52:11Z"
    },
    {
      "number": 694,
      "title": "fix(QA-PY-004): a vocabulary of method names where a structural test belonged",
      "url": "https://github.com/Sergey-Bar/Mjolnir/pull/694",
      "state": "merged",
      "head_sha": "5f8669e84bfe0b7362a0e347aeb67914ca89d302",
      "base_sha": "c2b1a33c75bf1e29a3db5b259e664fa9f3a7739c",
      "created_at": "2026-09-28T16:23:34Z",
      "updated_at": "2026-09-28T17:57:32Z",
      "merged_at": "2026-09-28T17:57:30Z"
    },
    {
      "number": 693,
      "title": "fix(QA-PY-007): the precision gate never fired for nested code",
      "url": "https://github.com/Sergey-Bar/Mjolnir/pull/693",
      "state": "merged",
      "head_sha": "1a797d23304edc686deb62f24abf4f619c6156bb",
      "base_sha": "abde96ba1dc230a1573560b9e8ca1b8f734715fc",
      "created_at": "2026-09-28T15:31:28Z",
      "updated_at": "2026-09-28T15:41:58Z",
      "merged_at": "2026-09-28T15:41:56Z"
    },
    {
      "number": 692,
      "title": "refactor(rules): demote 19 unsubstantiated core rules and classify the last 28 verdicts",
      "url": "https://github.com/Sergey-Bar/Mjolnir/pull/692",
      "state": "merged",
      "head_sha": "fd874be12d685baa485eab53bd98d7edc2bf4268",
      "base_sha": "d6dcc8222f0b4b294a1d176cd581519dbb3f472a",
      "created_at": "2026-09-28T12:59:37Z",
      "updated_at": "2026-09-28T14:01:14Z",
      "merged_at": "2026-09-28T14:01:11Z"
    },
    {
      "number": 691,
      "title": "feat(engine): a build identity that is not a version number",
      "url": "https://github.com/Sergey-Bar/Mjolnir/pull/691",
      "state": "merged",
      "head_sha": "fc49100b9e95eea78b4f7444e2a8becc3230d2ee",
      "base_sha": "8e6eb3ce6e24523a72788fc8ca1c03dde2297750",
      "created_at": "2026-09-28T10:39:20Z",
      "updated_at": "2026-09-28T11:41:34Z",
      "merged_at": "2026-09-28T11:41:31Z"
    },
    {
      "number": 690,
      "title": "docs: install the published package by its latest dist-tag",
      "url": "https://github.com/Sergey-Bar/Mjolnir/pull/690",
      "state": "merged",
      "head_sha": "5ea2999e60fda91193172d49a020bf93756d959f",
      "base_sha": "95d08a79a28a6cece3379f9d4df0ffb6cef7d27d",
      "created_at": "2026-09-28T05:33:19Z",
      "updated_at": "2026-09-28T05:48:53Z",
      "merged_at": "2026-09-28T05:48:51Z"
    },
    {
      "number": 689,
      "title": "fix(ci): give the action-tag push a credential it actually has",
      "url": "https://github.com/Sergey-Bar/Mjolnir/pull/689",
      "state": "merged",
      "head_sha": "b8f10efc32154c128e960a30460c32fe65f139ac",
      "base_sha": "1b2a4ef93a1d135c66dd53a4415eb15feb684e67",
      "created_at": "2026-09-28T03:57:21Z",
      "updated_at": "2026-09-28T04:13:21Z",
      "merged_at": "2026-09-28T04:13:19Z"
    },
    {
      "number": 688,
      "title": "feat(proof): stop the engine reporting what it did not do",
      "url": "https://github.com/Sergey-Bar/Mjolnir/pull/688",
      "state": "merged",
      "head_sha": "b743ce42b97cd1043b4c890f07baac3a8ecd84c4",
      "base_sha": "d9d7f827977d14857ae7e0ecf5c81009ea72a590",
      "created_at": "2026-09-27T23:12:13Z",
      "updated_at": "2026-09-28T09:28:56Z",
      "merged_at": "2026-09-28T09:28:54Z"
    },
    {
      "number": 687,
      "title": "fix(release): retry the dist-tag read instead of asserting it once",
      "url": "https://github.com/Sergey-Bar/Mjolnir/pull/687",
      "state": "merged",
      "head_sha": "bbd36ee3c5dc0adb2a2404d5f922bd1538698475",
      "base_sha": "8aff5fd29943f44472c0895bcb3b78a9c302285b",
      "created_at": "2026-09-27T21:35:38Z",
      "updated_at": "2026-09-27T21:41:48Z",
      "merged_at": "2026-09-27T21:41:34Z"
    },
    {
      "number": 686,
      "title": "fix(release): authorise the dist-tag move with a token, not OIDC",
      "url": "https://github.com/Sergey-Bar/Mjolnir/pull/686",
      "state": "merged",
      "head_sha": "53eb73c4f9d14a48eba34d5cd3ff7602ebecf177",
      "base_sha": "11ca0ad53b9109a5a66a20ecfdfe7647954508fc",
      "created_at": "2026-09-27T20:24:30Z",
      "updated_at": "2026-09-27T20:53:14Z",
      "merged_at": "2026-09-27T20:53:12Z"
    },
    {
      "number": 685,
      "title": "fix(release): authorise the dist-tag move with a token, not OIDC",
      "url": "https://github.com/Sergey-Bar/Mjolnir/pull/685",
      "state": "closed",
      "head_sha": "1071afdba94e3062248ef727c7e3801b75de39a7",
      "base_sha": "11ca0ad53b9109a5a66a20ecfdfe7647954508fc",
      "created_at": "2026-09-27T20:03:55Z",
      "updated_at": "2026-09-27T20:54:34Z",
      "merged_at": null
    },
    {
      "number": 684,
      "title": "fix(release): correct the setup-node pin in the dist-tag repair",
      "url": "https://github.com/Sergey-Bar/Mjolnir/pull/684",
      "state": "merged",
      "head_sha": "22cace5464ec68633baea319e7011e0ee86f1aae",
      "base_sha": "0ee7f80aa96816604e296047f33d396d68f6ffd7",
      "created_at": "2026-09-27T19:38:42Z",
      "updated_at": "2026-09-27T19:49:13Z",
      "merged_at": "2026-09-27T19:49:11Z"
    },
    {
      "number": 683,
      "title": "fix(release): correct the setup-node pin in the dist-tag repair",
      "url": "https://github.com/Sergey-Bar/Mjolnir/pull/683",
      "state": "closed",
      "head_sha": "c1a1d49ccef19e17e763baa6307f78efbe64f389",
      "base_sha": "0ee7f80aa96816604e296047f33d396d68f6ffd7",
      "created_at": "2026-09-27T19:18:11Z",
      "updated_at": "2026-09-27T20:54:34Z",
      "merged_at": null
    },
    {
      "number": 682,
      "title": "fix(release): decouple the dist-tag repair, and make it dispatchable",
      "url": "https://github.com/Sergey-Bar/Mjolnir/pull/682",
      "state": "merged",
      "head_sha": "d031019aa5e786653156a06fb38c5103f8e96251",
      "base_sha": "9f9f3e943025da3cc5c15e610cc1992a2ae9854f",
      "created_at": "2026-09-27T18:25:49Z",
      "updated_at": "2026-09-27T18:57:28Z",
      "merged_at": "2026-09-27T18:57:27Z"
    },
    {
      "number": 681,
      "title": "ci(release): unblock the action major tag, and record the 5.0.0 authorization",
      "url": "https://github.com/Sergey-Bar/Mjolnir/pull/681",
      "state": "merged",
      "head_sha": "1819b7a23f9e681a543141ca45313fc91398ce41",
      "base_sha": "fa3b9b8b03441b780a5de4fc9e2d645cb728506c",
      "created_at": "2026-09-27T17:14:54Z",
      "updated_at": "2026-09-27T17:29:37Z",
      "merged_at": "2026-09-27T17:29:35Z"
    },
    {
      "number": 680,
      "title": "feat(v6): the Wave 0-2 truth baseline, proof model and QA-IR",
      "url": "https://github.com/Sergey-Bar/Mjolnir/pull/680",
      "state": "merged",
      "head_sha": "e33a5836022fc209e74bec4ff5527d8c2ff1e1fc",
      "base_sha": "e33a128c3af617670dfd1e4e408210c7a48c697a",
      "created_at": "2026-09-27T13:36:13Z",
      "updated_at": "2026-09-27T14:08:27Z",
      "merged_at": "2026-09-27T14:08:25Z"
    },
    {
      "number": 679,
      "title": "fix(certs): stop the manifest gate depending on the local object store",
      "url": "https://github.com/Sergey-Bar/Mjolnir/pull/679",
      "state": "merged",